Handle,Title,Body (HTML),Vendor,Product Category,Type,Tags,Published,Option1 Name,Option1 Value,Variant SKU,Variant Grams,Variant Inventory Tracker,Variant Inventory Qty,Variant Inventory Policy,Variant Fulfillment Service,Variant Price,Variant Compare At Price,Variant Requires Shipping,Variant Taxable,Gift Card,SEO Title,SEO Description,Status
hydrating-hyaluronic-serum,Hydrating Hyaluronic Serum,"<p>A weightless daily serum powered by multi-weight <strong>hyaluronic acid</strong> and <strong>5% vitamin B5</strong> to flood skin with moisture and visibly plump in two weeks. Fragrance-free and suitable for sensitive skin.</p><ul><li>Up to 72 hours of hydration</li><li>Plumps fine lines &amp; smooths texture</li><li>Vegan &amp; cruelty-free</li></ul>",Aurelle,Health & Beauty > Personal Care > Cosmetics > Skin Care,Serum,"badge:Bestseller, badge:Vegan, skin:Hydration, concern:Dryness, hydration",TRUE,Size,30ml,AUR-HHS-30,120,shopify,150,deny,manual,32.00,40.00,TRUE,TRUE,FALSE,Hydrating Hyaluronic Serum | Aurelle Skincare,"Weightless hyaluronic acid + B5 serum for up to 72h hydration and visibly plumper skin. Vegan, fragrance-free.",active
hydrating-hyaluronic-serum,,,,,,,,Size,50ml,AUR-HHS-50,180,shopify,120,deny,manual,44.00,55.00,TRUE,TRUE,FALSE,,,active
vitamin-c-brightening-serum,Vitamin C Brightening Serum,"<p>A stabilised <strong>15% vitamin C</strong> serum with ferulic acid and vitamin E that visibly brightens, evens tone and defends against daily pollution. Lightweight, fast-absorbing, and non-greasy.</p><ul><li>Fades dark spots &amp; uneven tone</li><li>Antioxidant pollution defence</li><li>Brighter, more radiant skin in 4 weeks</li></ul>",Aurelle,Health & Beauty > Personal Care > Cosmetics > Skin Care,Serum,"badge:New, skin:Brightening, concern:Dark spots, brightening",TRUE,Size,30ml,AUR-VCS-30,130,shopify,140,deny,manual,38.00,48.00,TRUE,TRUE,FALSE,Vitamin C Brightening Serum | Aurelle Skincare,"15% vitamin C + ferulic acid serum to brighten, even tone and defend skin. Visibly radiant in 4 weeks.",active
gentle-gel-cleanser,Gentle Gel Cleanser,"<p>A pH-balanced gel cleanser with <strong>aloe</strong> and <strong>green tea</strong> that lifts away makeup, SPF and impurities without stripping your barrier. Leaves skin clean, calm and never tight.</p><ul><li>Non-stripping, barrier-friendly</li><li>Removes makeup &amp; SPF</li><li>For all skin types, daily use</li></ul>",Aurelle,Health & Beauty > Personal Care > Cosmetics > Skin Care,Cleanser,"badge:Vegan, skin:Hydration, concern:Daily care, cleanser",TRUE,Size,150ml,AUR-GGC-150,210,shopify,160,deny,manual,22.00,,TRUE,TRUE,FALSE,Gentle Gel Cleanser | Aurelle Skincare,"pH-balanced aloe & green tea gel cleanser that removes makeup and SPF without stripping skin.",active
barrier-repair-moisturizer,Barrier Repair Moisturizer,"<p>A rich-yet-breathable cream with <strong>ceramides</strong>, <strong>niacinamide</strong> and squalane that rebuilds a compromised barrier, locks in moisture and calms redness overnight.</p><ul><li>Strengthens skin barrier</li><li>24-hour moisture lock</li><li>Calms redness &amp; sensitivity</li></ul>",Aurelle,Health & Beauty > Personal Care > Cosmetics > Skin Care,Moisturizer,"badge:Bestseller, skin:Barrier repair, concern:Sensitivity, barrier-repair",TRUE,Size,50ml,AUR-BRM-50,190,shopify,130,deny,manual,36.00,45.00,TRUE,TRUE,FALSE,Barrier Repair Moisturizer | Aurelle Skincare,"Ceramide + niacinamide cream that rebuilds the skin barrier, locks in moisture and calms redness.",active
spf-50-mineral-sunscreen,SPF 50 Mineral Sunscreen,"<p>A weightless <strong>mineral SPF 50</strong> with zinc oxide that shields against UVA/UVB without white cast or grease. Doubles as a smoothing makeup primer for everyday wear.</p><ul><li>Broad-spectrum SPF 50 PA++++</li><li>No white cast, no grease</li><li>Reef-friendly mineral filters</li></ul>",Aurelle,Health & Beauty > Personal Care > Cosmetics > Skin Care,Sunscreen,"badge:New, badge:Vegan, skin:Barrier repair, concern:Sun protection, barrier-repair",TRUE,Size,50ml,AUR-SPF-50,170,shopify,150,deny,manual,28.00,34.00,TRUE,TRUE,FALSE,SPF 50 Mineral Sunscreen | Aurelle Skincare,"Weightless mineral SPF 50 with zinc oxide — broad-spectrum protection, no white cast. Reef-friendly.",active
the-complete-routine-kit,The Complete Routine Kit,"<p>Your full clean routine in one bundle: <strong>Gentle Gel Cleanser</strong>, <strong>Hydrating Hyaluronic Serum</strong> and <strong>Barrier Repair Moisturizer</strong>. Everything your skin needs morning and night — at 20% off buying separately.</p>",Aurelle,Health & Beauty > Personal Care > Cosmetics > Skin Care,Bundle,"badge:Bestseller, bundle, value",TRUE,Title,Default Title,AUR-KIT-01,520,shopify,90,deny,manual,89.00,112.00,TRUE,TRUE,FALSE,The Complete Routine Kit | Aurelle Skincare,"Cleanser, serum and moisturiser bundle — your full Aurelle routine at 20% off. Clean, vegan, effective.",active
